start_sec;end_sec;mark;text;duration
0,22556;2,48955;(...) relacional... não é?;relacional não é;2,2639899999999997
4,4;15,0795;que está subjacente no comportamento... e de certa forma... influencia esse comportamento;que está subjacente no comportamento e de certa forma influencia esse comportamento;10,679499999999999
19,85007;49,16856;na última::... parte... da::s das aulas de::... terça-feira passada tinha muito pouca gente... mas vocês não viram então um texto que eu analisei... de Benjamin Whorf... sobre os hopi;na última parte das das aulas de terçafeira passada tinha muito pouca gente mas vocês não viram então um texto que eu analisei de benjamin whorf sobre os hopi;29,31849
50,82129;51,65546;--quem estava aqui?;quem estava aqui;0,8341700000000003
55,59331;56,93512;então quem me diz alguma coisa?;então quem me diz alguma coisa;1,3418099999999953
56,93512;58,39727;vamos ajudar os colegas--;vamos ajudar os colegas;1,4621500000000012
59,71257;72,58807;qual é a diferença entre a forma de pensar dos hopi... e a forma de pensar dos indivíduos que pertencem... a grupos integrados na tradição cultural do ocidente?;qual é a diferença entre a forma de pensar dos hopi e a forma de pensar dos indivíduos que pertencem a grupos integrados na tradição cultural do ocidente;12,875500000000002
74,69602;75,06468;hã?;ah;0,36865999999999133
96,48;101,07862;você já está saltando sobre o aspecto linguístico para chegar nas consequências não é?;você já está saltando sobre o aspecto linguístico para chegar nas consequências não é;4,598619999999997
112,12;112,6592;certo;certo;0,5391999999999939
113,32;115,59684;não existe passado presente e futuro;não existe passado presente e futuro;2,276840000000007
116,96526;125,63871;agora me diga uma coisa... eles não têm ideia então ninguém se casa por exemplo marca a data do casamento e não se casa porque não tem ideia do futuro?;agora me diga uma coisa eles não têm ideia então ninguém se casa por exemplo marca a data do casamento e não se casa porque não tem ideia do futuro;8,673450000000003
153,46703;153,96262;exato;exato;0,49558999999999287
154,57926;169,45763;aqui o Whorf diz... não há ideia então... de um conTInuum... compreendem?... isto é... alguma coisa que se perde numa perspectiva infinita às nossas costas;aqui o whorf diz não há ideia então de um continuum compreendem isto é alguma coisa que se perde numa perspectiva infinita às nossas costas;14,87836999999999
170,30314;171,02309;que é o passado;que é o passado;0,719949999999983
172,83216;176,67919;alguma coisa que é um ponto onde nós estamos... certo?;alguma coisa que é um ponto onde nós estamos certo;3,847030000000018
177,47783;187,8312;e alguma coisa que se dirige... para um horizonte e se perde no fim do horizonte... que nós chamamos de futuro... certo?;e alguma coisa que se dirige para um horizonte e se perde no fim do horizonte que nós chamamos de futuro certo;10,353369999999984
189,65883;198,78615;isto é... como eu disse a vocês... uma das ideias fundamentais no ocidente... é a ideia de viagem;isto é como eu disse a vocês uma das ideias fundamentais no ocidente é a ideia de viagem;9,127319999999997
199,90587;201,37598;a ideia de peregrinação;a ideia de peregrinação;1,4701100000000054
203,37942;208,7457;nós podemos aproximar isto então... da literatura religiosa do ocidente;nós podemos aproximar isto então da literatura religiosa do ocidente;5,366279999999989
209,76505;213,13183;''nossa vida é um via/ é uma viagem pelo vale de lágrimas'';nossa vida é um via é uma viagem pelo vale de lágrimas;3,3667800000000057
213,13183;214,08;--vocês já não ouviram isso?--;vocês já não ouviram isso;0,9481700000000046
214,08;219,98715;tem alguns católicos que... vão à igreja ao domingo... e ouvem sermões não é?;tem alguns católicos que vão à igreja ao domingo e ouvem sermões não é;5,9071500000000015
219,98715;236,23135;esta ideia da viagem eu creio que tenha uma importância imensa... em todas as mitologias que influenciaram... i::sto este todo extremamente complexo... que se chama... a civilização ocidental;esta ideia da viagem eu creio que tenha uma importância imensa em todas as mitologias que influenciaram isto este todo extremamente complexo que se chama a civilização ocidental;16,244199999999978
238,32939;256,39846;uma das primeiras... obras literárias que se conhece da humanidade... é a epopeia de Gilgamesh... que::... foi escrita em língua assíria se não me engano ou sumeriana não sei em que diabo de língua foi escrita;uma das primeiras obras literárias que se conhece da humanidade é a epopeia de gilgamesh que foi escrita em língua assíria se não me engano ou sumeriana não sei em que diabo de língua foi escrita;18,06907000000001
257,02025;259,46536;e que aliás até hoje se lê com:: agrado;e que aliás até hoje se lê com agrado;2,4451099999999997
262,09364;268,44328;em que a::... Gilgamesh tem um amigo que chama-se Enquidu esse amigo... era imortal;em que a gilgamesh tem um amigo que chamase enquidu esse amigo era imortal;6,349640000000022
269,66669;272,32017;e ela tinha a simplicidade dos animais;e ela tinha a simplicidade dos animais;2,653480000000002
273,07488;277,70648;de repente ele conhece a mulher e através da mulher... a doença a morte;de repente ele conhece a mulher e através da mulher a doença a morte;4,631599999999992
277,70648;284,9547;são lendas... que PREexistiram à elaboração da Bíblia... e tiveram uma influência muito grande sobre a Bíblia;são lendas que preexistiram à elaboração da bíblia e tiveram uma influência muito grande sobre a bíblia;7,248220000000003
285,84;287,10753;daí chega a serpente;daí chega a serpente;1,267530000000022
287,10753;289,75449;ele vai em busca da imortalidade Gilgamesh;ele vai em busca da imortalidade gilgamesh;2,6469599999999787
291,48;295,70976;e a serpente rouba a imortalidade dele a serpente se torna imortal;e a serpente rouba a imortalidade dele a serpente se torna imortal;4,229759999999999
297,39204;306,03997;mas enfim... a estrutura da narrativa é uma estrutura de uma viagem... cheia de percalços cheias de aventuras;mas enfim a estrutura da narrativa é uma estrutura de uma viagem cheia de percalços cheias de aventuras;8,647929999999974
306,44;315,56547;vocês pegam a literatura do Ocidente toda... Odisseia por exemplo... a Eneida né?... há toda esta ideia de viagem;vocês pegam a literatura do ocidente toda odisseia por exemplo a eneida né há toda esta ideia de viagem;9,125470000000007
315,78637;318,28099;isto tem uma influência muito grande eu creio;isto tem uma influência muito grande eu creio;2,4946199999999976
319,48;320,71013;--eu estou chutando aqui um pouco--;eu estou chutando aqui um pouco;1,2301299999999742
323,68;328,7305;isto tem um::... uns resquícios desta teoria... nalguns autores;isto tem um uns resquícios desta teoria nalguns autores;5,0504999999999995
329,93819;333,39908;mas em suma... eu acho uma coisa muito interessante como sugestão;mas em suma eu acho uma coisa muito interessante como sugestão;3,4608900000000062
333,39908;334,54927;como hipótese de trabalho;como hipótese de trabalho;1,1501899999999523
335,47094;344,67234;a ideia de que a viagem os povos do ocidente... que... viveram... em constantes:: andanças::;a ideia de que a viagem os povos do ocidente que viveram em constantes andanças;9,201400000000035
345,65275;349,28994;Europa é uma península da Ásia que sofreu todas as invasões possíveis;europa é uma península da ásia que sofreu todas as invasões possíveis;3,6371899999999755
350,24589;357,99156;então esta mobilidade deu uma certa ideia de mobilidade social... e de mobilidade no tempo e o espaço;então esta mobilidade deu uma certa ideia de mobilidade social e de mobilidade no tempo e o espaço;7,745670000000018
358,68534;370,5162;até nós chegarmos às ideias de tempo e espaço... que existem na nossa cultura... e que são o fruto da elaboração milenar do pensamento;até nós chegarmos às ideias de tempo e espaço que existem na nossa cultura e que são o fruto da elaboração milenar do pensamento;11,83086000000003
371,34849;380,27728;chegou a uma forma... precisa... por exemplo em relação ao espaço... num homem que se chamava René Descartes... compreendem?;chegou a uma forma precisa por exemplo em relação ao espaço num homem que se chamava rené descartes compreendem;8,928789999999992
381,03899;393,48406;mas antes de René Descartes houve um outro que chamava-se Leonardo da Vinci... e que deu a forma final a uma noção pers-pec-ti-va... certo?;mas antes de rené descartes houve um outro que chamavase leonardo da vinci e que deu a forma final a uma noção perspectiva certo;12,445069999999987
394,24282;396,52992;todos vocês conhecem a Santa Ceia pelo menos;todos vocês conhecem a santa ceia pelo menos;2,2871000000000095
396,99834;398,41147;para não falar na Gioconda não é?;para não falar na gioconda não é;1,4131300000000238
399,42773;406,72248;a Gioconda... segundo Claude Valéry... foi o pedaço de tela tecida que mais asneiras ouviu no mundo;a gioconda segundo claude valéry foi o pedaço de tela tecida que mais asneiras ouviu no mundo;7,294750000000022
407,78908;411,73464;todo mundo em Paris chega frente à Gioconda... e diz asneiras (né?);todo mundo em paris chega frente à gioconda e diz asneiras né;3,9455600000000004
413,23495;417,94114;mas na Gioconda... mas especialmente na Ceia... há essa... perspectiva;mas na gioconda mas especialmente na ceia há essa perspectiva;4,706189999999992
418,6491;421,18481;vocês aprenderam ainda desenho nas escolas;vocês aprenderam ainda desenho nas escolas;2,5357100000000514
421,18481;427,31113;na minha época... havia as famosas perspectivas de ponto de fuga vocês aprenderam isso nas aulas de desenho?;na minha época havia as famosas perspectivas de ponto de fuga vocês aprenderam isso nas aulas de desenho;6,126319999999964
428,27434;433,19085;os pontos de fuga... as coisas que vêm do fundo... até nós;os pontos de fuga as coisas que vêm do fundo até nós;4,916510000000017
434,98126;438,72862;esta ideia de espaço... não é universal;esta ideia de espaço não é universal;3,747359999999958
441,11581;446,64825;por exemplo... em toda pintura egípcia não havia essa noção de espaço;por exemplo em toda pintura egípcia não havia essa noção de espaço;5,532440000000008
448,95897;456,64195;para se representar... o exército do faraó... punha-se a primeira fileira do exército... num plano;para se representar o exército do faraó punhase a primeira fileira do exército num plano;7,682979999999986
457,27411;463,57402;em seguida... aCIma desta fileira... outra fileira... compreende?;em seguida acima desta fileira outra fileira compreende;6,299910000000011
465,5718;466,66732;e assim por diante;e assim por diante;1,0955200000000218
468,03333;477,82961;na... plástica nas artes plásticas no Oriente e na China... e no Japão... a perspectiva é diversa;na plástica nas artes plásticas no oriente e na china e no japão a perspectiva é diversa;9,796280000000024
479,52578;485,41601;é uma perspectiva em que há um primeiro plano mais nítido e um outro plano que é sempre superior ao primeiro;é uma perspectiva em que há um primeiro plano mais nítido e um outro plano que é sempre superior ao primeiro;5,890230000000031
487,04206;498,15886;hipótese de trabalho que eu acho um pouco infantil... é o fato... dos japoneses e chineses... estarem sempre sentados ou ajoelhados e verem as pessoas numa certa perspectiva;hipótese de trabalho que eu acho um pouco infantil é o fato dos japoneses e chineses estarem sempre sentados ou ajoelhados e verem as pessoas numa certa perspectiva;11,116800000000012
500,56053;511,22496;não não funciona isso isto é muito... uma hipótese derivada... de uma psicologia de um reforço de situações que eu acho que não explica toda a questão;não não funciona isso isto é muito uma hipótese derivada de uma psicologia de um reforço de situações que eu acho que não explica toda a questão;10,664429999999982
511,87295;516,27126;mas em suma... o que é fundamental é o seguinte;mas em suma o que é fundamental é o seguinte;4,398309999999981
516,27126;557,7987;as noções de espaço e de tempo as noções de causabilidade... as noções relativas aos problemas fundamentais da existência... que guiam... que põem... direções que dão (pautas)... à ação dos grupos... são derivadas de conceitos... que... radicam vamos dizer que... saem... se não se se não são totalmente determinados são em grande parte determinados... por... hábitos linguísticos;as noções de espaço e de tempo as noções de causabilidade as noções relativas aos problemas fundamentais da existência que guiam que põem direções que dão pautas à ação dos grupos são derivadas de conceitos que radicam vamos dizer que saem se não se se não são totalmente determinados são em grande parte determinados por hábitos linguísticos;41,52744000000007
557,7987;558,68475;... certo?;certo;0,8860499999999547
560,50171;562,82107;isto é... voltando aos hopi;isto é voltando aos hopi;2,3193599999999606
565,10845;576,9641;existe... na mitologia hopi... a ideia fundamental de uma... força atuante central que é o coração do universo;existe na mitologia hopi a ideia fundamental de uma força atuante central que é o coração do universo;11,855650000000082
579,8517;589,48178;desta força central derivam... forças parciais... que animam... tudo o que existe no universo;desta força central derivam forças parciais que animam tudo o que existe no universo;9,630079999999907
592,21184;595,33932;então... não existe nada de inanimado;então não existe nada de inanimado;3,1274799999999914
595,51821;609,46142;vocês encontram em certos manuais sobretudo manuais brasileiros... que estão quarenta ou cinquenta anos em retardo sobre a... os avanços da ciência... vocês encontram a palavra animismo;vocês encontram em certos manuais sobretudo manuais brasileiros que estão quarenta ou cinquenta anos em retardo sobre a os avanços da ciência vocês encontram a palavra animismo;13,943210000000022
609,70497;610,54792;--já ouviram falar nisso?--;já ouviram falar nisso;0,8429499999999734
612,19301;613,88926;é uma concepção falsa;é uma concepção falsa;1,6962500000000773
616,54771;634,3154;porque supôs-se... a princípio nos primeiros contatos entre... muitas vezes missionários exploradores e povos de outra tradição que não a ocidental... que eles atribuíram uma ALma... a objetos e a plantas;porque supôsse a princípio nos primeiros contatos entre muitas vezes missionários exploradores e povos de outra tradição que não a ocidental que eles atribuíram uma alma a objetos e a plantas;17,767689999999902
635,50731;655,94193;mas a noção de alma é uma noção complexa... é uma noção que foi... refinada... através... da tradição judaica... ahn da filosofia grega... que foi um dos componentes essenciais... do:: CristiaNISmo compreendem?;mas a noção de alma é uma noção complexa é uma noção que foi refinada através da tradição judaica ah da filosofia grega que foi um dos componentes essenciais do cristianismo compreendem;20,434619999999995
656,28;660,97446;não há uma atribuição de alma:: a objetos ou a plantas;não há uma atribuição de alma a objetos ou a plantas;4,694460000000049
661,80211;671,98637;supõe-se que estas plantas... os objetos o mundo inteiro... é animado de certa forças compreendem?;supõese que estas plantas os objetos o mundo inteiro é animado de certa forças compreendem;10,184259999999995
673,70435;677,62207;forças... éh que se revelam em certo momento;forças eh que se revelam em certo momento;3,917720000000031
677,62207;681,92737;então elas existem em estado latente... compreendem?;então elas existem em estado latente compreendem;4,305299999999988
684,14516;692,00807;então há uma espécie de eterno p::resente... que é um presente mitológico;então há uma espécie de eterno presente que é um presente mitológico;7,862909999999943
694,78517;698,2016;o mito... não é um acontecimento do passado;o mito não é um acontecimento do passado;3,416429999999991
700,69423;706,93145;o mito é algo que aconteceu... segundo... um esquema narrativo;o mito é algo que aconteceu segundo um esquema narrativo;6,237220000000093
708,18337;711,31127;que pode obedecer a variações mas há uma hisTÓria no mito;que pode obedecer a variações mas há uma história no mito;3,127900000000068
713,67326;726,67767;mas::... uma vez que se desenrolou este drama do mito... este drama não tem fim... porque ele se repete sempre ele é um presente eterno;mas uma vez que se desenrolou este drama do mito este drama não tem fim porque ele se repete sempre ele é um presente eterno;13,004410000000007
727,34326;728,13971;--isto ficou claro?--;isto ficou claro;0,7964500000000498
729,6463;743,50297;isto não é só característico dos hopi... é característico de todo grupo... que::... tenha (um conceito) da existência... baseado em mitos ou seja todo grupo humano praticamente;isto não é só característico dos hopi é característico de todo grupo que tenha um conceito da existência baseado em mitos ou seja todo grupo humano praticamente;13,856670000000008
744,67176;757,78517;mas alguns... põem ÊNfase... nesse eterno presente... em que... há forças... ocultas que de repente se manifestam;mas alguns põem ênfase nesse eterno presente em que há forças ocultas que de repente se manifestam;13,113410000000044
758,99711;772,68329;como diz... ahn Whorf... ''não se pode dizer que as coisas vão acontecer... que elas aconteceram... ou que elas aconteceram agora;como diz ah whorf não se pode dizer que as coisas vão acontecer que elas aconteceram ou que elas aconteceram agora;13,686180000000036
772,68329;777,03803;as coisas sempre... se E-VEN-TU-AM''... (lembram-se disso?);as coisas sempre se eventuam lembramse disso;4,3547399999999925
777,77905;782,46776;--eu procurei no Pequeno Dicionário... da Língua Portuguesa e não encontrei a palavra eventuar;eu procurei no pequeno dicionário da língua portuguesa e não encontrei a palavra eventuar;4,688710000000015
784,66281;787,90992;e em inglês é palavra raro eu vi lá termo raro;e em inglês é palavra raro eu vi lá termo raro;3,2471100000000206
790,22435;811,78853;mas ele diz para o hopi... a coisa... não surge à existência porque houve um passado que levou a certas... ah ações determinadas... há um presente... em que as coisas então são:: contemporâneas... e depois o futuro... certo?;mas ele diz para o hopi a coisa não surge à existência porque houve um passado que levou a certas ah ações determinadas há um presente em que as coisas então são contemporâneas e depois o futuro certo;21,56418000000008
812,60057;819,60722;há... um conjunto... de indícios que é necessário interpretar;há um conjunto de indícios que é necessário interpretar;7,006650000000036
820,91561;824,01475;de onde a importância da magia e da religião;de onde a importância da magia e da religião;3,099140000000034
825,04114;833,85411;e esses indícios mostram que de repente... uma força... num determinado momento... se manifesta;e esses indícios mostram que de repente uma força num determinado momento se manifesta;8,81296999999995
836,68052;841,16384;Lévi-Strauss em La Pensée Sauvage... diz o seguinte;lévistrauss em la pensée sauvage diz o seguinte;4,483320000000049
841,87365;849,47626;''por que nós supomos que o nosso modo... de interpretar o mundo... é... o modo verdadeiro?'';por que nós supomos que o nosso modo de interpretar o mundo é o modo verdadeiro;7,602610000000027
850,81307;865,47477;e ele encontra no pensamento... de certos grupos... ah selvagens... alguma coisa que está mais de acordo... com a física atômica... compreende?;e ele encontra no pensamento de certos grupos ah selvagens alguma coisa que está mais de acordo com a física atômica compreende;14,661699999999996
865,74136;868,64775;porque eu acho eu não não estou de acordo com isto;porque eu acho eu não não estou de acordo com isto;2,9063899999999876
870,64474;877,77415;--eu não andei pichando muito Lévi-Strauss para vocês porque senão vocês não conhecem mas eu há anos que eu... me bato contra o Estruturalismo--;eu não andei pichando muito lévistrauss para vocês porque senão vocês não conhecem mas eu há anos que eu me bato contra o estruturalismo;7,129410000000007
878,92804;888,96069;em todo o caso... neste nível de análise... eu creio que nós podemos utilizarmos desta reflexão;em todo o caso neste nível de análise eu creio que nós podemos utilizarmos desta reflexão;10,03264999999999
891,2639;901,27899;para um grande número... de grupos humanos... existem então... forças que surgem... que se manifestam então;para um grande número de grupos humanos existem então forças que surgem que se manifestam então;10,015089999999987
903,90001;909,41638;o verbo entre os hopi... tem... duas categorias;o verbo entre os hopi tem duas categorias;5,516370000000052
909,41638;910,37347;segundo Whorf;segundo whorf;0,9570899999999938
911,09994;917,29717;notem eu não sei... se isto não foi completamente transformado pela linguística moderna;notem eu não sei se isto não foi completamente transformado pela linguística moderna;6,197230000000104
937,08494;943,94109;isto... antes de Jakobson começar a visitar os Estados Unidos depois o Estruturalismo linguístico dominou;isto antes de jakobson começar a visitar os estados unidos depois o estruturalismo linguístico dominou;6,856150000000071
944,69981;945,94948;acho que a Linguística de um modo;acho que a linguística de um modo;1,2496700000000374
974,71073;979,20157;no século dezoito existiram... indivíduos que... defenderam esta ideia;no século dezoito existiram indivíduos que defenderam esta ideia;4,490839999999935
982,14479;986,4292;quem deu uma feição mais científica foi... Humboldt;quem deu uma feição mais científica foi humboldt;4,2844100000000935
991,15771;1016,73804;a ideia de que... o indivíduo... PEN::sa... por meio de símbolos linguísticos... a estrutura da língua... então dita... a forma do pensamento... o indivíduo vê... o universo... através dos rótulos que a língua coloca sobre o universo... a ação do indivíduo é norteada pela língua;a ideia de que o indivíduo pensa por meio de símbolos linguísticos a estrutura da língua então dita a forma do pensamento o indivíduo vê o universo através dos rótulos que a língua coloca sobre o universo a ação do indivíduo é norteada pela língua;25,580330000000004
1018,16395;1026,84834;há então... uma influência... da língua... que é DEcisiva na formação do pensamento;há então uma influência da língua que é decisiva na formação do pensamento;8,684390000000008
1027,68308;1032,40679;mas... a começar pela própria percepção;mas a começar pela própria percepção;4,723709999999983
1035,1164;1036,40649;o indivíduo não percebe;o indivíduo não percebe;1,2900899999999638
1036,40649;1038,12617;--aí nós estamos no terreno de vocês--;aí nós estamos no terreno de vocês;1,7196799999999257
1039,42067;1041,42662;quem diz alguma coisa sobre percepção?;quem diz alguma coisa sobre percepção;2,0059499999999844
1042,40668;1043,91496;vocês já tiveram curso sobre percepção?;vocês já tiveram curso sobre percepção;1,5082800000000134
1045,2;1046,00264;ninguém teve?;ninguém teve;0,802639999999883
1049,99905;1050,81068;cadê o segundo ano?;cadê o segundo ano;0,8116300000001502
1050,81068;1051,95673;tem alguém do segundo ano?;tem alguém do segundo ano;1,1460500000000593
1053,82033;1056,89622;bom... daí em todo caso gestalt vocês sabem o que é?;bom daí em todo caso gestalt vocês sabem o que é;3,075890000000072
1058,88;1061,16799;gestalt... teoria da gestalt;gestalt teoria da gestalt;2,287989999999809
1062,17212;1063,41022;quem me diz o que é gestalt?;quem me diz o que é gestalt;1,2381000000000313
1065,90401;1066,09403;ahn?;ah;0,19002000000000407
1069,892;1070,1028;ahn?;ah;0,21079999999983556
1071,67936;1072,62709;só o segundo ano?;só o segundo ano;0,947729999999865
1073,35964;1080,67544;ahn tem tem tem alguns do segundo ano que ficaram né? que... resolveram topar... o curso ou não?;ah tem tem tem alguns do segundo ano que ficaram né que resolveram topar o curso ou não;7,315800000000081
1087,4443;1087,74714;ahn;ah;0,3028399999998328
1090,2045;1090,98833;ah hoje tem prova?;ah hoje tem prova;0,7838299999998526
1092,34815;1093,94389;ah mas porque não não não avisaram?;ah mas porque não não não avisaram;1,595739999999978
1093,94389;1095,54461;a gente podia fazer mais um dia então;a gente podia fazer mais um dia então;1,6007199999999102
1095,54461;1100,00609;bom... a coisa está tao atrapalhada que não vale a pena atrapalhar mais né?;bom a coisa está tao atrapalhada que não vale a pena atrapalhar mais né;4,461480000000165
1102,91208;1115,88583;em suma... vocês todos têm uma ideia geral... do organismo... que é a base... e o conceito-chave para o estudo da Psicologia;em suma vocês todos têm uma ideia geral do organismo que é a base e o conceitochave para o estudo da psicologia;12,973749999999882
1117,33389;1136,24936;o organismo... não é... uma máquina... dotada... de::... órgão de recepção passiva... de estímulos... e que responde a esses estímulos com passavidade;o organismo não é uma máquina dotada de órgão de recepção passiva de estímulos e que responde a esses estímulos com passavidade;18,915469999999914
1136,24936;1137,15632;vocês sabem disso;vocês sabem disso;0,9069600000000264
1138,72292;1141,5771;o organismo é essencialmente atividade;o organismo é essencialmente atividade;2,854180000000042
