start_sec;end_sec;mark;text;duration
2208,20566;2208,90409;isto é clássico;isto é clássico;0,6984299999999166
2209,81008;2211,44765;a palavra mädchen... em alemão;a palavra mdchen em alemão;1,6375699999998687
2213,53989;2221,96356;mädchen... que significa moça... éh... menina... como é diminutivo vai para o gênero neutro em alemão;mdchen que significa moça eh menina como é diminutivo vai para o gênero neutro em alemão;8,42367000000013
2221,96356;2223,73252;mas ele diz ''que gênero é esse?'';mas ele diz que gênero é esse;1,768959999999879
2223,99517;2225,09014;respondeu o candidato;respondeu o candidato;1,0949699999996483
2225,97331;2226,45441;''neutro'';neutro;0,48109999999996944
2228,39832;2229,1752;''por que neutro?'';por que neutro;0,7768800000003466
2230,6001;2234,67397;ele pensou então disse ''eu acho que as meninas alemãs pertencem ao gênero neutro'';ele pensou então disse eu acho que as meninas alemãs pertencem ao gênero neutro;4,073869999999715
2240,41398;2254,84913;o que eu quero dizer com tudo isto... é que existem hábitos linguísticos... mas::... a língua... não encerra... dentro de si... todos os processos do pensamento;o que eu quero dizer com tudo isto é que existem hábitos linguísticos mas a língua não encerra dentro de si todos os processos do pensamento;14,435150000000249
2256,68143;2261,40071;(por exemplo)... nós vamos entrar na próxima aula na análise de mitos e símbolos;por exemplo nós vamos entrar na próxima aula na análise de mitos e símbolos;4,719279999999799
2265,21877;2268,70842;parece-me que o pensamento místico transcende;pareceme que o pensamento místico transcende;3,4896499999999833
2270,15081;2275,96;do mundo... que está contido dentro dos significados linguísticos compreende?;do mundo que está contido dentro dos significados linguísticos compreende;5,809189999999944
2275,96;2287,39141;toda língua tende... a dar como significado alguma coisa a mais do que está contido... dentro da estrita estrutura linguística;toda língua tende a dar como significado alguma coisa a mais do que está contido dentro da estrita estrutura linguística;11,431410000000142
2289,14874;2295,54483;isto que dá possibilidade... de se traduzir qualquer coisa de uma língua para outra;isto que dá possibilidade de se traduzir qualquer coisa de uma língua para outra;6,396089999999731
2298,44285;2301,11822;eu já ouvi... esta afirmação;eu já ouvi esta afirmação;2,67536999999993
2302,39554;2303,49401;''não há traduções;não há traduções;1,0984699999999066
2304,68025;2305,81424;ninguém traduz nada'';ninguém traduz nada;1,1339900000002672
2309,79508;2327,75727;na verdade... o que se pode dizer... é que... em cada língua cada palavra tem um sentido especial... ela desperta existe em TORno dela... uma série de significados... claros... e latentes;na verdade o que se pode dizer é que em cada língua cada palavra tem um sentido especial ela desperta existe em torno dela uma série de significados claros e latentes;17,96219000000019
2328,60631;2330,76627;o que se chama conotação e denotação;o que se chama conotação e denotação;2,1599599999999555
2332,29309;2340,35423;de modo como cada em cada língua essas palavras são um pouco diferentes... cada sentido de uma palavra em cada língua é único;de modo como cada em cada língua essas palavras são um pouco diferentes cada sentido de uma palavra em cada língua é único;8,061139999999796
2342,79215;2350,39306;ahn se eu digo a uma criança mauzinha por exemplo... não é a mesma coisa que o italiano que diz a uma criança cacivo;ah se eu digo a uma criança mauzinha por exemplo não é a mesma coisa que o italiano que diz a uma criança cacivo;7,600909999999658
2352,13376;2353,38566;cacivo significa mau;cacivo significa mau;1,2518999999997504
2353,56462;2356,08385;é curioso a transformação linguística que houve;é curioso a transformação linguística que houve;2,5192299999998795
2357,53788;2362,5272;mas há um... um halo semântico que chamava-se antigamente isto;mas há um um halo semântico que chamavase antigamente isto;4,989320000000134
2363,64347;2369,19254;e que eu esqueci porque eu estou com duas linguistas na sala e eu estou me arriscando num assunto que eu não trato há muitos anos;e que eu esqueci porque eu estou com duas linguistas na sala e eu estou me arriscando num assunto que eu não trato há muitos anos;5,549070000000029
2371,56266;2382,28539;mas então... existe um modo peculiar de conceber a palavra... que é característico de cada língua e não passa à outra compreende?;mas então existe um modo peculiar de conceber a palavra que é característico de cada língua e não passa à outra compreende;10,722729999999956
2385,46153;2390,01364;mas a tradução... é uma reconstrução da outra língua;mas a tradução é uma reconstrução da outra língua;4,552110000000084
2391,02952;2398,34504;mas é capaz de transmitir... o essencial que está num texto da língua a ser traduzida;mas é capaz de transmitir o essencial que está num texto da língua a ser traduzida;7,315520000000106
2400,53553;2404,54963;sem isso não seria possível a comunicação entre os homens... certo?;sem isso não seria possível a comunicação entre os homens certo;4,014099999999871
2405,55136;2410,16143;então... eu estou supondo o seguinte;então eu estou supondo o seguinte;4,610070000000178
2412,55675;2414,25757;a língua faz o pensamento?;a língua faz o pensamento;1,7008200000000215
2419,01943;2419,90227;de certa forma;de certa forma;0,8828400000002148
2422,03558;2428,69108;vocês vejam em ciências humanas... Psicologia está mais... um pouco mais ligada às ciências biológicas por exemplo;vocês vejam em ciências humanas psicologia está mais um pouco mais ligada às ciências biológicas por exemplo;6,655499999999847
2429,66725;2443,32746;mas em ciências humanas... uma das coisas terríveis é que... nenhuma afirmação é totalmente errônea... é muito uma questão de matizes de precisar bem o sentido;mas em ciências humanas uma das coisas terríveis é que nenhuma afirmação é totalmente errônea é muito uma questão de matizes de precisar bem o sentido;13,660210000000006
2445,09631;2449,50543;que não se possa pensar SEM a linguagem... é uma verdade ou não?;que não se possa pensar sem a linguagem é uma verdade ou não;4,409120000000257
2452,46856;2469,41097;eu acredito que não se pode pensar... CLAramente... que não se pode articular o pensamento... sem o uso de categorias gramaticais que levam... de um... PAsso do pensamento a outro;eu acredito que não se pode pensar claramente que não se pode articular o pensamento sem o uso de categorias gramaticais que levam de um passo do pensamento a outro;16,94241000000011
2470,70709;2474,37356;mas existem as formas mais obscu::ras de pensar;mas existem as formas mais obscuras de pensar;3,6664700000001176
2475,175;2484,08289;existe o pensamento emergente de um fundo conativo-afetivo... que ainda não atingiu a clareza da cognição;existe o pensamento emergente de um fundo conativoafetivo que ainda não atingiu a clareza da cognição;8,907889999999952
2486,9653;2489,2261;eu não estou dizendo nada de místico para vocês;eu não estou dizendo nada de místico para vocês;2,2608000000000175
2489,2261;2490,52418;porque eu sei que há isto;porque eu sei que há isto;1,2980800000000272
2492,87354;2497,38537;porque existe em todas as línguas uma coisa que se chama poesia;porque existe em todas as línguas uma coisa que se chama poesia;4,511829999999918
2499,00053;2499,92761;e o que é a poesia?;e o que é a poesia;0,9270800000003874
2501,87434;2510,3163;é exatamente... a apreensão... de sentidos NOvos para as palavras... compreendem?;é exatamente a apreensão de sentidos novos para as palavras compreendem;8,441960000000108
2513,21685;2515,0871;poesia e... muitas vezes a prosa;poesia e muitas vezes a prosa;1,8702500000003965
2518,69377;2534,16923;num escrito de Eça de Queirós da juventude ele dizia... que::... ''os prados estavam revestidos de uma erva... tão louça... de uma verde tão moço'';num escrito de eça de queirós da juventude ele dizia que os prados estavam revestidos de uma erva tão louça de uma verde tão moço;15,475460000000112
2536,07586;2548,08469;um crítico disse... os absurdos da pseudo da escola pseudocientífica que saiu de Coimbra... um verde moço moço é um adjetivo que só se pode aplicar a coisas humanas;um crítico disse os absurdos da pseudo da escola pseudocientífica que saiu de coimbra um verde moço moço é um adjetivo que só se pode aplicar a coisas humanas;12,008830000000216
2550,18087;2551,24975;ora eu acho admirável;ora eu acho admirável;1,0688799999998082
2551,24975;2555,75896;eu vejo mais o verde do Eça do que outros verdes românticos... compreendem?;eu vejo mais o verde do eça do que outros verdes românticos compreendem;4,5092100000001665
2556,60399;2566,34909;ele usou... uma palavra... que designa qualquer coisa de exclusivamente humano... para alguma coisa da natureza... e nos deu então a noção;ele usou uma palavra que designa qualquer coisa de exclusivamente humano para alguma coisa da natureza e nos deu então a noção;9,745100000000093
2566,34909;2573,89718;quer dizer o verde::... loução o verde... ahn::... viçoso e tudo mais eram coisas gastas;quer dizer o verde loução o verde ah viçoso e tudo mais eram coisas gastas;7,548089999999775
2574,04791;2575,92781;ele usou a palavra verde de moço;ele usou a palavra verde de moço;1,8799000000003616
2577,90671;2599,50068;quer dizer em toda língua... há... uma parte cristalizada no sistema... e há... a língua que se elabora... que está se fazendo... uma língua que lança mão de recursos expressivos da linguagem... para criar novas aplicações de termos;quer dizer em toda língua há uma parte cristalizada no sistema e há a língua que se elabora que está se fazendo uma língua que lança mão de recursos expressivos da linguagem para criar novas aplicações de termos;21,5939699999999
2600,62216;2621,65116;existe... na concepção estruturalista... uma ideia de estrutura linguística que demasiado rígida... para meu gosto... porque... o característico... de todo organismo de todo sistema vivo... é o contínuo devir é a mudança... contínua;existe na concepção estruturalista uma ideia de estrutura linguística que demasiado rígida para meu gosto porque o característico de todo organismo de todo sistema vivo é o contínuo devir é a mudança contínua;21,028999999999996
2623,17104;2628,82391;então... há sempre possibilidade de t::ranscender o esquema linguístico;então há sempre possibilidade de transcender o esquema linguístico;5,6528699999998935
2629,64687;2634,46144;então nós cairíamos nalguma coisa que... que chama a CRIatividade humana;então nós cairíamos nalguma coisa que que chama a criatividade humana;4,814570000000003
2637,77167;2670,89199;vocês compreendem... que se nós admitirmos... que uma estrutura... seja linguística ou seja social... se impõe... aos membros do grupo... e que essa estrutura... cria... cérebros pensantes... com hábitos linguísticos inteiramente estabilizados... à imagem e semelhança da sua própria estrutura... nós estamos negando a História;vocês compreendem que se nós admitirmos que uma estrutura seja linguística ou seja social se impõe aos membros do grupo e que essa estrutura cria cérebros pensantes com hábitos linguísticos inteiramente estabilizados à imagem e semelhança da sua própria estrutura nós estamos negando a história;33,12031999999999
2673,63951;2676,56383;nós estamos negando esta renovação contín/;nós estamos negando esta renovação contín;2,9243200000000797
2676,56383;2681,55405;a língua... se transforma... como a sociedade se transforma;a língua se transforma como a sociedade se transforma;4,990220000000136
2683,18129;2695,70339;o meu maior interesse neste momento da minha carreira... não é a estrutura... e todas as explicações que se podem fundar na estrutura;o meu maior interesse neste momento da minha carreira não é a estrutura e todas as explicações que se podem fundar na estrutura;12,522100000000137
2697,40681;2703,90024;eu estou interessado especialmente... em saber COmo se explica a estrutura;eu estou interessado especialmente em saber como se explica a estrutura;6,493429999999989
2705,81276;2708,25797;a estrutura surgiu num certo momento;a estrutura surgiu num certo momento;2,4452100000003156
2708,7272;2709,04311;como?;como;0,31591000000025815
2711,27283;2713,85933;como de uma estrutura sai outra estrutura?;como de uma estrutura sai outra estrutura;2,586500000000342
2714,88039;2722,68;e eu creio que há uma... ÊNfase... que dura há muitas décadas... nas Ciências Sociais;e eu creio que há uma ênfase que dura há muitas décadas nas ciências sociais;7,79961000000003
2723,17028;2733,03307;uma ênfase... posta na estrutura em que... a mudança da estrutura... é concebida como algo de aNÔmalo;uma ênfase posta na estrutura em que a mudança da estrutura é concebida como algo de anômalo;9,862790000000132
2733,03307;2734,82877;uma CRIse e muda a estrutura;uma crise e muda a estrutura;1,7957000000001244
2736,00881;2747,83151;ora... nós podemos... em Psicologia... em Psicologia... em Sociologia deixe de lado a Linguística... que eu tive alguns cursos há muitos anos;ora nós podemos em psicologia em psicologia em sociologia deixe de lado a linguística que eu tive alguns cursos há muitos anos;11,822700000000168
2747,83151;2754,64596;meu último curso formal de Linguística... foi... em mil novecentos e quarenta e oito né?;meu último curso formal de linguística foi em mil novecentos e quarenta e oito né;6,814449999999852
2755,62911;2757,51085;portanto vocês veem isto é pré-histórico não é?;portanto vocês veem isto é préhistórico não é;1,8817400000002635
2759,45543;2768,7955;então... nestas ciências do comportamento huMAno... nós podemos adotar um outro ponto de vista que é o seguinte;então nestas ciências do comportamento humano nós podemos adotar um outro ponto de vista que é o seguinte;9,340070000000196
2770,09467;2774,29242;o movimento... a transformação são contínuos;o movimento a transformação são contínuos;4,197750000000269
2775,81316;2786,60444;a transformação a dinâmica não é tanto um problema... certas transformações se cristalizam e entram a fazer parte de estruturas;a transformação a dinâmica não é tanto um problema certas transformações se cristalizam e entram a fazer parte de estruturas;10,791279999999915
2787,78137;2789,90249;e este é um problema... certo?;e este é um problema certo;2,1211199999997916
0,22556;1,30697;(...) relacional;relacional;1,08141
2,22718;2,48955;não é?;não é;0,26236999999999977
4,4;7,72189;que está subjacente no comportamento;que está subjacente no comportamento;3,32189
9,76845;11,3627;e de certa forma;e de certa forma;1,5942500000000006
12,5509;15,0795;influencia esse comportamento;influencia esse comportamento;2,528599999999999
19,85007;20,76693;na última::;na última;0,9168599999999998
21,28982;21,96372;parte;parte;0,6738999999999997
23,64969;24,50915;da::s;das;0,8594600000000021
24,50915;25,67449;das aulas de::;das aulas de;1,165339999999997
26,05252;28,53085;terça-feira passada tinha muito pouca gente;terçafeira passada tinha muito pouca gente;2,4783299999999997
30,3804;33,13678;mas vocês não viram então um texto;mas vocês não viram então um texto;2,75638
33,13678;34,2865;que eu analisei;que eu analisei;1,149719999999995
35,69241;37,21785;de Benjamin Whorf;de benjamin whorf;1,5254399999999961
48,18847;49,16856;sobre os hopi;sobre os hopi;0,980089999999997
50,82129;51,65546;--quem estava aqui?;quem estava aqui;0,8341700000000003
55,59331;56,93512;então quem me diz alguma coisa?;então quem me diz alguma coisa;1,3418099999999953
56,93512;58,39727;vamos ajudar os colegas--;vamos ajudar os colegas;1,4621500000000012
59,71257;63,56002;qual é a diferença entre a forma de pensar dos hopi;qual é a diferença entre a forma de pensar dos hopi;3,847450000000002
64,44106;68,32338;e a forma de pensar dos indivíduos que pertencem;e a forma de pensar dos indivíduos que pertencem;3,882320000000007
69,0;72,58807;a grupos integrados na tradição cultural do ocidente?;a grupos integrados na tradição cultural do ocidente;3,588070000000002
74,69602;75,06468;hã?;ah;0,36865999999999133
96,48;100,81931;você já está saltando sobre o aspecto linguístico para chegar nas consequências;você já está saltando sobre o aspecto linguístico para chegar nas consequências;4,339309999999998
100,81931;101,07862;não é?;não é;0,25930999999999926
112,12;112,6592;certo;certo;0,5391999999999939
113,32;115,59684;não existe passado presente e futuro;não existe passado presente e futuro;2,276840000000007
116,96526;117,49336;agora;agora;0,5280999999999949
117,49336;118,38377;me diga uma coisa;me diga uma coisa;0,8904100000000028
119,65846;122,26812;eles não têm ideia então ninguém se casa;eles não têm ideia então ninguém se casa;2,609659999999991
122,26812;122,59947;por exemplo;por exemplo;0,3313500000000005
122,59947;125,63871;marca a data do casamento e não se casa porque não tem ideia do futuro?;marca a data do casamento e não se casa porque não tem ideia do futuro;3,0392400000000066
128,63557;129,28303;como é a his/;como é a his;0,6474599999999953
153,46703;153,96262;exato;exato;0,49558999999999287
154,57926;156,09923;aqui o Whorf diz;aqui o whorf diz;1,5199700000000007
156,32394;157,89344;não há ideia então;não há ideia então;1,569500000000005
158,97127;160,66228;de um conTInuum;de um continuum;1,6910100000000057
161,77438;162,29996;compreendem?;compreendem;0,5255799999999908
163,15936;163,65066;isto é;isto é;0,4912999999999954
164,32859;168,1094;alguma coisa que se perde numa perspectiva infinita;alguma coisa que se perde numa perspectiva infinita;3,7808100000000024
168,1094;169,45763;às nossas costas;às nossas costas;1,348230000000001
170,30314;171,02309;que é o passado;que é o passado;0,719949999999983
172,83216;175,8714;alguma coisa que é um ponto onde nós estamos;alguma coisa que é um ponto onde nós estamos;3,0392400000000066
176,18408;176,67919;certo?;certo;0,49511000000001104
177,47783;179,32615;e alguma coisa que se dirige;e alguma coisa que se dirige;1,848320000000001
180,03173;180,89246;para um horizonte;para um horizonte;0,8607299999999896
180,89246;182,94529;e se perde no fim do horizonte;e se perde no fim do horizonte;2,05283
184,81481;185,67555;que nós;que nós;0,8607399999999927
185,67555;186,80288;chamamos de futuro;chamamos de futuro;1,1273300000000006
187,3856;187,8312;certo?;certo;0,4455999999999847
189,65883;190,10443;isto é;isto é;0,4456000000000131
190,889;192,21438;como eu disse a vocês;como eu disse a vocês;1,3253799999999956
192,93801;195,96915;uma das ideias fundamentais no ocidente;uma das ideias fundamentais no ocidente;3,031140000000022
197,45449;198,78615;é a ideia de viagem;é a ideia de viagem;1,3316599999999994
199,90587;201,37598;a ideia de peregrinação;a ideia de peregrinação;1,4701100000000054
203,37942;205,64552;nós podemos aproximar isto então;nós podemos aproximar isto então;2,2660999999999945
206,16;208,7457;da literatura religiosa do ocidente;da literatura religiosa do ocidente;2,5857000000000028
209,76505;210,87335;''nossa vida é um via/;nossa vida é um via;1,1082999999999856
210,87335;213,13183;é uma viagem pelo vale de lágrimas'';é uma viagem pelo vale de lágrimas;2,25848000000002
213,13183;214,08;--vocês já não ouviram isso?--;vocês já não ouviram isso;0,9481700000000046
214,08;215,33823;tem alguns católicos que;tem alguns católicos que;1,2582299999999975
216,01234;217,34915;vão à igreja ao domingo;vão à igreja ao domingo;1,336810000000014
218,31138;219,64057;e ouvem sermões;e ouvem sermões;1,3291899999999828
219,64057;219,98715;não é?;não é;0,3465800000000172
219,98715;221,58184;esta ideia da viagem;esta ideia da viagem;1,5946899999999857
221,58184;223,13955;eu creio que tenha uma importância;eu creio que tenha uma importância;1,5577100000000144
223,13955;223,8746;imensa;imensa;0,7350499999999727
224,59442;227,68502;em todas as mitologias que influenciaram;em todas as mitologias que influenciaram;3,090599999999995
228,72366;229,29114;i::sto;isto;0,5674800000000175
229,29114;230,2966;este todo;este todo;1,0054599999999994
230,2966;232,2235;extremamente complexo;extremamente complexo;1,9268999999999892
233,47652;234,34611;que se chama;que se chama;0,8695900000000165
234,55177;236,23135;a civilização ocidental;a civilização ocidental;1,6795799999999872
238,32939;239,89471;uma das primeiras;uma das primeiras;1,565320000000014
240,81258;241,54801;obras;obras;0,735430000000008
241,54801;242,72486;literárias;literárias;1,1768500000000017
242,72486;244,72055;que se conhece da humanidade;que se conhece da humanidade;1,9956899999999962
245,7222;248,15392;é a epopeia de Gilgamesh;é a epopeia de gilgamesh;2,4317200000000128
250,61705;251,06646;que::;que;0,4494100000000003
251,89673;253,55105;foi escrita em língua assíria ;foi escrita em língua assíria;1,6543200000000127
253,55105;254,22758;se não me engano;se não me engano;0,6765299999999854
254,22758;254,80526;ou sumeriana n;ou sumeriana n;0,5776800000000151
254,80526;256,39846;ão sei em que diabo de língua foi escrita;ão sei em que diabo de língua foi escrita;1,593199999999996
257,02025;258,8179;e que aliás até hoje se lê com::;e que aliás até hoje se lê com;1,7976500000000328
258,8179;259,46536;agrado;agrado;0,6474599999999668
262,09364;263,0883;em que a::;em que a;0,9946600000000103
263,54152;266,02361;Gilgamesh tem um amigo que chama-se Enquidu;gilgamesh tem um amigo que chamase enquidu;2,482090000000028
266,02361;266,76628;esse amigo;esse amigo;0,7426699999999755
267,4;268,44328;era imortal;era imortal;1,0432800000000384
269,66669;272,32017;e ela tinha a simplicidade dos animais;e ela tinha a simplicidade dos animais;2,653480000000002
273,07488;275,70317;de repente ele conhece a mulher e através da mulher;de repente ele conhece a mulher e através da mulher;2,6282899999999927
276,36;277,70648;a doença a morte;a doença a morte;1,3464799999999855
277,70648;278,86429;são lendas;são lendas;1,1578099999999836
279,41371;282,50627;que PREexistiram à elaboração da Bíblia;que preexistiram à elaboração da bíblia;3,0925599999999918
282,80666;284,9547;e tiveram uma influência muito grande sobre a Bíblia;e tiveram uma influência muito grande sobre a bíblia;2,1480399999999804
285,84;287,10753;daí chega a serpente;daí chega a serpente;1,267530000000022
287,10753;287,59884;ele vai;ele vai;0,4913099999999986
287,59884;289,04229;em busca da imortalidade;em busca da imortalidade;1,4434499999999844
289,04229;289,75449;Gilgamesh;gilgamesh;0,7121999999999957
291,48;294,08755;e a serpente rouba a imortalidade dele;e a serpente rouba a imortalidade dele;2,6075500000000034
294,08755;295,70976;a serpente se torna imortal;a serpente se torna imortal;1,6222099999999955
297,39204;297,91382;mas enfim;mas enfim;0,5217799999999784
298,38227;301,70335;a estrutura da narrativa é uma estrutura de uma viagem;a estrutura da narrativa é uma estrutura de uma viagem;3,321079999999995
303,51489;304,66507;cheia de percalços;cheia de percalços;1,1501800000000344
304,66507;306,03997;cheias de aventuras;cheias de aventuras;1,3748999999999683
306,44;309,113;vocês pegam a literatura do Ocidente toda;vocês pegam a literatura do ocidente toda;2,673000000000002
310,14893;310,85733;Odisseia;odisseia;0,7083999999999833
310,85733;311,53145;por exemplo;por exemplo;0,6741200000000163
312,01846;312,81064;a Eneida;a eneida;0,7921799999999735
312,81064;313,12295;né?;né;0,31231000000002496
313,84;315,56547;há toda esta ideia de viagem;há toda esta ideia de viagem;1,7254700000000298
315,78637;317,86327;isto tem uma influência muito grande;isto tem uma influência muito grande;2,0769000000000233
317,86327;318,28099;eu creio;eu creio;0,41771999999997433
319,48;320,71013;--eu estou chutando aqui um pouco--;eu estou chutando aqui um pouco;1,2301299999999742
323,68;324,41158;isto tem um::;isto tem um;0,7315800000000081
324,75435;326,50629;uns resquícios desta teoria;uns resquícios desta teoria;1,7519399999999905
327,62982;328,7305;nalguns autores;nalguns autores;1,1006800000000112
329,93819;330,64277;mas em suma;mas em suma;0,7045799999999645
330,77607;333,39908;eu acho uma coisa muito interessante como sugestão;eu acho uma coisa muito interessante como sugestão;2,623010000000022
333,39908;334,54927;como hipótese de trabalho;como hipótese de trabalho;1,1501899999999523
335,47094;336,99917;a ideia de que a viagem;a ideia de que a viagem;1,5282300000000077
336,99917;338,78539;os povos do ocidente;os povos do ocidente;1,7862200000000144
340,23265;340,68096;que;que;0,44831000000004906
340,9209;341,62549;viveram;viveram;0,704589999999996
341,86162;343,51073;em constantes::;em constantes;1,6491100000000074
343,51073;344,67234;andanças::;andanças;1,161609999999996
345,65275;349,28994;Europa é uma península da Ásia que sofreu todas as invasões possíveis;europa é uma península da ásia que sofreu todas as invasões possíveis;3,6371899999999755
350,24589;354,8157;então esta mobilidade deu uma certa ideia de mobilidade social;então esta mobilidade deu uma certa ideia de mobilidade social;4,569810000000018
355,48;357,99156;e de mobilidade no tempo e o espaço;e de mobilidade no tempo e o espaço;2,5115599999999745
358,68534;360,34373;até nós chegarmos;até nós chegarmos;1,6583899999999971
360,34373;362,79755;às ideias de tempo e espaço;às ideias de tempo e espaço;2,4538200000000074
363,62674;365,46353;que existem na nossa cultura;que existem na nossa cultura;1,8367900000000077
